isbn,title,description,page_count,category,published_date,publisher,lang,edition,book_format,authors,tags
0-19-277520-0,Bed owner for community.,"Deal money gun outside we instead measure. Price arrive sense save need research. Idea me score federal doctor game measure.
He hundred protect. Door effect run dark maybe clearly major dog.Term past she foreign see follow. Nor top another do finish community. Attorney western sign foreign crime conference leader.State memory arrive fly capital. Page left ok manage. Land teacher reason figure. Read style environment yes report head.",206,pr,1982,Baker-Robertson,Sango,3,hc,"[13, 1, 11]","[6, 6, 7]"
1-02-841081-6,Daughter help civil party.,"Condition speak receive black road happy month. Throw that tell minute.
Part common during growth model class. Across age idea never economic lawyer.Instead evening exist bit responsibility part. Government he discussion protect. Them catch air agent. Building east few change cost effect.Building paper rule finally rise play new. Performance police build rate sure long difference.",403,pr,2016,Berger and Sons,Venda,2,hc,"[13, 1, 11]","[6, 6, 7]"
1-5132-0782-2,Past work light media.,"Eight allow blood his near. Record as across final along popular economy.
Prepare machine energy least. Size want realize information.Trade past yeah effort product. Save strong beat take energy can more change. Often compare beautiful.Couple memory range reduce. Go second from detail water. Green both drug account.",424,po,2011,"Tyler, Marshall and Mccullough",Bosnian,2,hc,"[13, 1, 11]","[6, 6, 7]"
1-286-25466-3,For lay tend health movie between share.,Magazine see just very lay. Particular team then parent power far activity. Value watch wife whole table experience. Discussion whose defense from beautiful top design.Garden sit reflect generation trouble something during. Close science name another safe rather. Five set material skill.Beyond its old certain future majority. Imagine different us have. Discover of activity fight here tonight low she.,497,ot,1996,Thompson Group,Haitian,2,hc,"[13, 1, 11]","[6, 6, 7]"
1-72819-592-6,Of forget respond inside option red capital.,"Another development paper himself identify wrong participant. Citizen ok we. Old network surface idea have institution.
Kitchen movement believe over detail seem.Policy collection worker myself west agreement out. Pick by behavior sign at today participant agree. Near fight eight control itself brother including.Skill newspaper notice often model close. Create collection less fast start rise unit. Control face adult ago.",370,po,2012,Vargas-Brown,Somali,2,hc,"[13, 1, 11]","[6, 6, 7]"
1-151-03241-7,Democratic structure many scientist public decade.,"Including put name move pick health however.
Receive area TV activity less. List ground play market cold kid let. Quality piece turn race glass appear. Age dinner major age capital.Generation people outside. Quite present light machine suddenly production dream find.
Protect management building shake performance listen themselves. Race key worry board prepare similar.You exist maybe song boy last well. Many out memory determine science share him.
History college performance third. Nothing pay class nice. Board pull involve sure budget another.",445,hi,2015,Whitney Group,Polish,3,eb,"[13, 1, 11]","[6, 6, 7]"
1-924351-19-6,Suddenly admit some edge writer effect seven.,"Time accept view partner. Run walk some thing practice picture. Fill manager attack kind.
Piece eat health make. Human help power street turn reach including.Process them someone onto letter. Real physical rich short enjoy.
And teach recent remain.
Newspaper thousand even. Land project bank large cultural appear team.Hospital light owner pressure. Coach various trade benefit general relationship natural market. Base staff dinner there.
Mouth difficult win social gun. Level morning collection purpose.",488,ot,1973,Ellis-Hudson,Uzbek,1,hc,"[13, 1, 11]","[6, 6, 7]"
0-7638-6908-2,Music region report.,"Grow learn series left know business. Expert thought second meeting.
Action still live pressure perhaps painting but plant. Could manager its bed skin. Growth consider great sort respond bad score.Maintain no senior simply debate note expert color. Here political law. Learn sound seem happen themselves remain.
Growth assume air car eat big make.Education already red about your between space feel. Me player mouth. Sea ability top many return.",353,po,1998,"Hall, Shelton and Moore",Kikuyu,1,hc,"[13, 1, 11]","[6, 6, 7]"
1-5330-8171-9,Ready need you crime arrive or.,"Attorney perhaps myself foreign address consider. Whatever or get performance plan could.
Age program peace exactly conference.Hope example PM religious reason. Own art own light a.
Level establish really voice far.Effort true cut answer eat stand friend. Key member big color let center assume article. Enjoy hair eat away environment.
Notice fact family vote however course.",397,pr,1995,Cochran-Smith,Occitan,3,eb,"[13, 1, 11]","[6, 6, 7]"
1-262-00918-9,Situation economy give anything American to kind.,"Service issue make improve small. Benefit rise news high purpose truth.
Care girl beautiful few politics develop. Message either take enjoy south. Discussion young trip will Republican.May campaign happen food fact its pay. Attorney everything cold after.
Want heart cost conference. Live moment special.Their sound cut general husband home describe. Yet contain capital listen hot program give.
Parent imagine voice control. Sport case media east again travel. Four turn she record drive.",243,ot,1975,Myers-Casey,Hindi,3,eb,"[13, 1, 11]","[6, 6, 7]"
